id,ticker,stonk
1,FUTU,Futu Holdings Ltd
2,MVIS,Microvision
3,SI,Silvergate Capital Corp Cl A
4,EXPI,Exp Realty International
5,RIOT,Riot Blockchain Inc
6,DNM.W,Danimer Scientific Inc WT
7,TSLA,Tesla
8,TSLA,Tesla Inc.
9,KIRK,Kirkland's Inc
10,KOPN,Kopin Cp
11,AAL,American Airlines Group Inc. Common Stock
12,AAON,AAON Inc. Common Stock
13,AAPL,Apple Inc. Common Stock
14,AAWW,Atlas Air Worldwide Holdings NEW Common Stock
15,ABCB,Ameris Bancorp Common Stock
16,ABCL,AbCellera Biologics Inc. Common Shares
17,ABCM,Abcam plc American Depositary Shares
18,ABMD,ABIOMED Inc. Common Stock
19,ABNB,Airbnb Inc. Class A Common Stock
20,ACAD,ACADIA Pharmaceuticals Inc. Common Stock
21,ACGL,Arch Capital Group Ltd. Common Stock
22,ACHC,Acadia Healthcare Company Inc. Common Stock
23,ACIW,ACI Worldwide Inc. Common Stock
24,ACT,Enact Holdings Inc. Common Stock
25,ADBE,Adobe Inc. Common Stock
26,ADI,Analog Devices Inc. Common Stock
27,ADP,Automatic Data Processing Inc. Common Stock
28,ADPT,Adaptive Biotechnologies Corporation Common Stock
29,ADSK,Autodesk Inc. Common Stock
30,ADV,Advantage Solutions Inc. Class A Common Stock
31,AEIS,Advanced Energy Industries Inc. Common Stock
32,AEP,American Electric Power Company Inc. Common Stock
33,AFRM,Affirm Holdings Inc. Class A Common Stock
34,AGNC,AGNC Investment Corp. Common Stock
35,AHCO,AdaptHealth Corp. Common Stock
36,AIMC,Altra Industrial Motion Corp. Common Stock
37,AKAM,Akamai Technologies Inc. Common Stock
38,ALGM,Allegro MicroSystems Inc. Common Stock
39,ALGN,Align Technology Inc. Common Stock
40,ALGT,Allegiant Travel Company Common Stock
41,ALKS,Alkermes plc Ordinary Shares
42,ALNY,Alnylam Pharmaceuticals Inc. Common Stock
43,ALRM,Alarm.com Holdings Inc. Common Stock
44,ALTR,Altair Engineering Inc. Class A Common Stock
45,AMAT,Applied Materials Inc. Common Stock
46,AMBA,Ambarella Inc. Ordinary Shares
47,AMD,Advanced Micro Devices Inc. Common Stock
48,AMED,Amedisys Inc Common Stock
49,AMEH,Apollo Medical Holdings Inc. Common Stock
50,AMGN,Amgen Inc. Common Stock
51,AMKR,Amkor Technology Inc. Common Stock
52,AMPL,Amplitude Inc. Class A Common Stock
53,AMZN,Amazon.com Inc. Common Stock
54,ANAT,American National Group Inc. Common Stock
55,ANGI,Angi Inc. Class A Common Stock
56,ANSS,ANSYS Inc. Common Stock
57,APA,APA Corporation Common Stock
58,APLS,Apellis Pharmaceuticals Inc. Common Stock
59,APP,Applovin Corporation Class A Common Stock
60,APPF,AppFolio Inc. Class A Common Stock
61,APPN,Appian Corporation Class A Common Stock
62,APPS,Digital Turbine Inc. Common Stock
63,ARCB,ArcBest Corporation Common Stock
64,ARCC,Ares Capital Corporation Common Stock
65,ARGX,argenx SE American Depositary Shares
66,ARNA,Arena Pharmaceuticals Inc. Common Stock
67,ARVL,Arrival Ordinary Shares
68,ARVN,Arvinas Inc. Common Stock
69,ARWR,Arrowhead Pharmaceuticals Inc. Common Stock
70,ASML,ASML Holding N.V. New York Registry Shares
71,ASND,Ascendis Pharma A/S American Depositary Shares
72,ASO,Academy Sports and Outdoors Inc. Common Stock
73,ATRC,AtriCure Inc. Common Stock
74,ATVI,Activision Blizzard Inc. Common Stock
75,AUB,Atlantic Union Bankshares Corporation Common Stock
76,AUPH,Aurinia Pharmaceuticals Inc Ordinary Shares
77,AUR,Aurora Innovation Inc. Class A Common Stock
78,AVGO,Broadcom Inc. Common Stock
79,AVT,Avnet Inc. Common Stock
80,AXNX,Axonics Inc. Common Stock
81,AXON,Axon Enterprise Inc. Common Stock
82,AY,Atlantica Sustainable Infrastructure plc Ordinary Shares
83,AZN,AstraZeneca PLC American Depositary Shares
84,AZPN,Aspen Technology Inc. Common Stock
85,AZTA,Azenta Inc.
86,BANF,BancFirst Corporation Common Stock
87,BANR,Banner Corporation Common Stock
88,BCPC,Balchem Corporation Common Stock
89,BCRX,BioCryst Pharmaceuticals Inc. Common Stock
90,BEAM,Beam Therapeutics Inc. Common Stock
91,BECN,Beacon Roofing Supply Inc. Common Stock
92,BGNE,BeiGene Ltd. American Depositary Shares
93,BHF,Brighthouse Financial Inc. Common Stock
94,BIDU,Baidu Inc. ADS
95,BIGC,BigCommerce Holdings Inc. Series 1 Common Stock
96,BIIB,Biogen Inc. Common Stock
97,BILI,Bilibili Inc. American Depositary Shares
98,BKNG,Booking Holdings Inc. Common Stock
99,BKR,Baker Hughes Company Class A Common Stock
100,BL,BlackLine Inc. Common Stock
101,BLDP,Ballard Power Systems Inc. Common Shares
102,BLKB,Blackbaud Inc. Common Stock
103,BMBL,Bumble Inc. Class A Common Stock
104,BMRN,BioMarin Pharmaceutical Inc. Common Stock
105,BNTX,BioNTech SE American Depositary Share
106,BOKF,BOK Financial Corporation Common Stock
107,BPMC,Blueprint Medicines Corporation Common Stock
108,BPOP,Popular Inc. Common Stock
109,BRKR,Bruker Corporation Common Stock
110,BRZE,Braze Inc. Class A Common Stock
111,BSY,Bentley Systems Incorporated Class B Common Stock
112,BYND,Beyond Meat Inc. Common Stock
113,BZ,KANZHUN LIMITED American Depository Shares
114,CACC,Credit Acceptance Corporation Common Stock
115,CAR,Avis Budget Group Inc. Common Stock
116,CARG,CarGurus Inc. Class A Common Stock 
117,CASY,Casey's General Stores Inc. Common Stock
118,CATY,Cathay General Bancorp Common Stock
119,CBRL,Cracker Barrel Old Country Store Inc Common Stock
120,CBSH,Commerce Bancshares Inc. Common Stock
121,CCEP,Coca-Cola Europacific Partners plc Ordinary Shares
122,CCMP,CMC Materials Inc. Common Stock
123,CCOI,Cogent Communications Holdings Inc.
124,CDEV,Centennial Resource Development Inc. Class A Common Stock
125,CDK,CDK Global Inc. Common Stock
126,CDLX,Cardlytics Inc. Common Stock
127,CDNA,CareDx Inc. Common Stock
128,CDNS,Cadence Design Systems Inc. Common Stock
129,CDW,CDW Corporation Common Stock
130,CEGVV,Constellation Energy Corporation Common Stock When-Issued
131,CELH,Celsius Holdings Inc. Common Stock
132,CENT,Central Garden & Pet Company Common Stock
133,CENTA,Central Garden & Pet Company Class A Common Stock Nonvoting
134,CERE,Cerevel Therapeutics Holdings Inc. Common Stock
135,CERN,Cerner Corporation Common Stock
136,CERT,Certara Inc. Common Stock
137,CFLT,Confluent Inc. Class A Common Stock
138,CG,The Carlyle Group Inc. Common Stock
139,CGC,Canopy Growth Corporation Common Shares
140,CGNX,Cognex Corporation Common Stock
141,CHDN,Churchill Downs Incorporated Common Stock
142,CHK,Chesapeake Energy Corporation Common Stock
143,CHKP,Check Point Software Technologies Ltd. Ordinary Shares
144,CHNG,Change Healthcare Inc. Common Stock
145,CHRW,C.H. Robinson Worldwide Inc. Common Stock
146,CHTR,Charter Communications Inc. Class A Common Stock New
147,CHX,ChampionX Corporation Common Stock 
148,CIGI,Colliers International Group Inc. Subordinate Voting Shares
149,CINF,Cincinnati Financial Corporation Common Stock
150,CLBK,Columbia Financial Inc. Common Stock
151,CMCSA,Comcast Corporation Class A Common Stock
152,CME,CME Group Inc. Class A Common Stock
153,CNXC,Concentrix Corporation Common Stock
154,COHR,Coherent Inc. Common Stock
155,COIN,Coinbase Global Inc. Class A Common Stock
156,COKE,Coca-Cola Consolidated Inc. Common Stock
157,COLB,Columbia Banking System Inc. Common Stock
158,COLM,Columbia Sportswear Company Common Stock
159,CONE,CyrusOne Inc Common Stock
160,COOP,Mr. Cooper Group Inc. Common Stock
161,CORT,Corcept Therapeutics Incorporated Common Stock
162,CORZ,Core Scientific Inc. Common Stock
163,COST,Costco Wholesale Corporation Common Stock
164,COUP,Coupa Software Incorporated Common Stock
165,CPRT,Copart Inc. (DE) Common Stock
166,CRCT,Cricut Inc. Class A Common Stock
167,CRNC,Cerence Inc. Common Stock
168,CROX,Crocs Inc. Common Stock
169,CRSP,CRISPR Therapeutics AG Common Shares
170,CRUS,Cirrus Logic Inc. Common Stock
171,CRVL,CorVel Corp. Common Stock
172,CRWD,CrowdStrike Holdings Inc. Class A Common Stock
173,CSCO,Cisco Systems Inc. Common Stock (DE)
174,CSGP,CoStar Group Inc. Common Stock
175,CSQ,Calamos Strategic Total Return Common Stock
176,CSX,CSX Corporation Common Stock
177,CTAS,Cintas Corporation Common Stock
178,CTRE,CareTrust REIT Inc. Common Stock
179,CTSH,Cognizant Technology Solutions Corporation Class A Common Stock
180,CTXS,Citrix Systems Inc. Common Stock
181,CVAC,CureVac N.V. Ordinary Shares
182,CVBF,CVB Financial Corporation Common Stock
183,CVCO,Cavco Industries Inc. Common Stock When Issued
184,CVET,Covetrus Inc. Common Stock
185,CVLT,Commvault Systems Inc. Common Stock
186,CVT,Cvent Holding Corp. Common Stock
187,CWST,Casella Waste Systems Inc. Class A Common Stock
188,CYBR,CyberArk Software Ltd. Ordinary Shares
189,CYTK,Cytokinetics Incorporated Common Stock
190,CZR,Caesars Entertainment Inc. Common Stock
191,DADA,Dada Nexus Limited American Depositary Shares
192,DAVE,Dave Inc. Class A Common Stock
193,DBX,Dropbox Inc. Class A Common Stock
194,DCT,Duck Creek Technologies Inc. Common Stock
195,DDOG,Datadog Inc. Class A Common Stock
196,DH,Definitive Healthcare Corp. Class A Common Stock
197,DIOD,Diodes Incorporated Common Stock
198,DISCA,Discovery Inc. Series A Common Stock
199,DISCB,Discovery Inc. Series B Common Stock
200,DISCK,Discovery Inc. Series C Common Stock
201,DISH,DISH Network Corporation Class A Common Stock
202,DKNG,DraftKings Inc. Class A Common Stock
203,DLO,DLocal Limited Class A Common Shares
204,DLTR,Dollar Tree Inc. Common Stock
205,DNLI,Denali Therapeutics Inc. Common Stock
206,DNUT,Krispy Kreme Inc. Common Stock
207,DOCU,DocuSign Inc. Common Stock
208,DOOO,BRP Inc. (Recreational Products) Common Subordinate Voting Shares
209,DORM,Dorman Products Inc. Common Stock
210,DOX,Amdocs Limited Ordinary Shares
211,DRVN,Driven Brands Holdings Inc. Common Stock
212,DSEY,Diversey Holdings Ltd. Ordinary Shares
213,DSGX,Descartes Systems Group Inc. (The) Common Stock
214,DUOL,Duolingo Inc. Class A Common Stock
215,DWAC,Digital World Acquisition Corp. Class A Common Stock
216,DXCM,DexCom Inc. Common Stock
217,EA,Electronic Arts Inc. Common Stock
218,EBAY,eBay Inc. Common Stock
219,EBC,Eastern Bankshares Inc. Common Stock
220,EEFT,Euronet Worldwide Inc. Common Stock
221,ENPH,Enphase Energy Inc. Common Stock
222,ENSG,The Ensign Group Inc. Common Stock
223,ENTG,Entegris Inc. Common Stock
224,ENVX,Enovix Corporation Common Stock
225,EPAY,Bottomline Technologies Inc. Common Stock
226,EQIX,Equinix Inc. Common Stock REIT
227,EQRX,EQRx Inc.  Common Stock
228,ERIC,Ericsson American Depositary Shares
229,ERIE,Erie Indemnity Company Class A Common Stock
230,ESGR,Enstar Group Limited Ordinary Shares
231,ESLT,Elbit Systems Ltd. Ordinary Shares
232,ETSY,Etsy Inc. Common Stock
233,EVCM,EverCommerce Inc. Common Stock
234,EVO,Evotec SE American Depositary Shares
235,EWBC,East West Bancorp Inc. Common Stock
236,EXAS,Exact Sciences Corporation Common Stock
237,EXC,Exelon Corporation Common Stock
238,EXEL,Exelixis Inc. Common Stock
239,EXFY,Expensify Inc. Class A Common Stock
240,EXLS,ExlService Holdings Inc. Common Stock
241,EXPD,Expeditors International of Washington Inc. Common Stock
242,EXPE,Expedia Group Inc. Common Stock
243,EXPI,eXp World Holdings Inc. Common Stock
244,EXPO,Exponent Inc. Common Stock
245,EYE,National Vision Holdings Inc. Common Stock
246,FA,First Advantage Corporation Common Stock
247,FANG,Diamondback Energy Inc. Commmon Stock
248,FAST,Fastenal Company Common Stock
249,FATE,Fate Therapeutics Inc. Common Stock
250,FB,Meta Platforms Inc. Class A Common Stock
251,FCFS,FirstCash Holdings Inc. Common Stock
252,FCNCA,First Citizens BancShares Inc. Class A Common Stock
253,FELE,Franklin Electric Co. Inc. Common Stock
254,FFBC,First Financial Bancorp. Common Stock
255,FFIN,First Financial Bankshares Inc. Common Stock
256,FFIV,F5 Inc. Common Stock
257,FHB,First Hawaiian Inc. Common Stock
258,FIBK,First Interstate BancSystem Inc. Class A Common Stock
259,FISV,Fiserv Inc. Common Stock
260,FITB,Fifth Third Bancorp Common Stock
261,FIVE,Five Below Inc. Common Stock
262,FIVN,Five9 Inc. Common Stock
263,FIZZ,National Beverage Corp. Common Stock
264,FLEX,Flex Ltd. Ordinary Shares
265,FLYW,Flywire Corporation Voting Common Stock
266,FMBI,First Midwest Bancorp Inc. Common Stock
267,FOCS,Focus Financial Partners Inc. Class A Common Stock
268,FOLD,Amicus Therapeutics Inc. Common Stock
269,FORM,FormFactor Inc. FormFactor Inc. Common Stock
270,FOX,Fox Corporation Class B Common Stock
271,FOXA,Fox Corporation Class A Common Stock
272,FOXF,Fox Factory Holding Corp. Common Stock
273,FRHC,Freedom Holding Corp. Common Stock
274,FRME,First Merchants Corporation Common Stock
275,FROG,JFrog Ltd. Ordinary Shares
276,FRPT,Freshpet Inc. Common Stock
277,FRSH,Freshworks Inc. Class A Common Stock
278,FSLR,First Solar Inc. Common Stock
279,FSV,FirstService Corporation Common Shares
280,FTDR,Frontdoor Inc. Common Stock
281,FTNT,Fortinet Inc. Common Stock
282,FULT,Fulton Financial Corporation Common Stock
283,FUTU,Futu Holdings Limited American Depositary Shares
284,FWONA,Liberty Media Corporation Series A Liberty Formula One Common Stock
285,FWONK,Liberty Media Corporation Series C Liberty Formula One Common Stock
286,FWRD,Forward Air Corporation Common Stock
287,FYBR,Frontier Communications Parent Inc. Common Stock
288,GBDC,Golub Capital BDC Inc. Common Stock
289,GDRX,GoodRx Holdings Inc. Class A Common Stock
290,GDS,GDS Holdings Limited ADS
291,GFS,GlobalFoundries Inc. Ordinary Shares
292,GH,Guardant Health Inc. Common Stock
293,GILD,Gilead Sciences Inc. Common Stock
294,GLBE,Global-E Online Ltd. Ordinary Shares
295,GLPG,Galapagos NV American Depositary Shares
296,GLPI,Gaming and Leisure Properties Inc. Common Stock
297,GMAB,Genmab A/S ADS
298,GNTX,Gentex Corporation Common Stock
299,GO,Grocery Outlet Holding Corp. Common Stock
300,GOOG,Alphabet Inc. Class C Capital Stock
301,GOOGL,Alphabet Inc. Class A Common Stock
302,GRAB,Grab Holdings Limited Class A Ordinary Shares
303,GRFS,Grifols S.A. American Depositary Shares
304,GRUB,Just Eat Takeaway.com N.V. American Depositary Shares
305,GSHD,Goosehead Insurance Inc. Class A Common Stock
306,GT,The Goodyear Tire & Rubber Company Common Stock
307,GTLB,GitLab Inc. Class A Common Stock
308,HAIN,Hain Celestial Group Inc. (The) Common Stock
309,HALO,Halozyme Therapeutics Inc. Common Stock
310,HAS,Hasbro Inc. Common Stock
311,HBAN,Huntington Bancshares Incorporated Common Stock
312,HCM,HUTCHMED (China) Limited American Depositary Shares
313,HCP,HashiCorp Inc. Class A Common Stock
314,HELE,Helen of Troy Limited Common Stock
315,HHR,HeadHunter Group PLC American Depositary Shares
316,HLNE,Hamilton Lane Incorporated Class A Common Stock
317,HMHC,Houghton Mifflin Harcourt Company Common Stock
318,HOLX,Hologic Inc. Common Stock
319,HON,Honeywell International Inc. Common Stock
320,HOOD,Robinhood Markets Inc. Class A Common Stock
321,HOPE,Hope Bancorp Inc. Common Stock
322,HQY,HealthEquity Inc. Common Stock
323,HSIC,Henry Schein Inc. Common Stock
324,HST,Host Hotels & Resorts Inc. Common Stock
325,HTHT,Huazhu Group Limited American Depositary Shares
326,HTLF,Heartland Financial USA Inc. Common Stock
327,HTZ,Hertz Global Holdings Inc Common Stock
328,HUBG,Hub Group Inc. Class A Common Stock
329,HWC,Hancock Whitney Corporation Common Stock
330,HZNP,Horizon Therapeutics Public Limited Company Ordinary Shares
331,IAC,IAC/InterActiveCorp Common Stock
332,IART,Integra LifeSciences Holdings Corporation Common Stock
333,IAS,Integral Ad Science Holding Corp. Common Stock
334,IBKR,Interactive Brokers Group Inc. Class A Common Stock
335,IBOC,International Bancshares Corporation Common Stock
336,IBRX,ImmunityBio Inc. Common Stock
337,IBTX,Independent Bank Group Inc Common Stock
338,ICLR,ICON plc Ordinary Shares
339,ICUI,ICU Medical Inc. Common Stock
340,IDCC,InterDigital Inc. Common Stock
341,IDXX,IDEXX Laboratories Inc. Common Stock
342,IEP,Icahn Enterprises L.P. Common Stock
343,IHRT,iHeartMedia Inc. Class A Common Stock
344,IIVI,II-VI Incorporated Common Stock
345,ILMN,Illumina Inc. Common Stock
346,INCY,Incyte Corp. Common Stock
347,INDB,Independent Bank Corp. Common Stock
348,INMD,InMode Ltd. Ordinary Shares
349,INSM,Insmed Inc. Common Stock
350,INTC,Intel Corporation Common Stock
351,INTU,Intuit Inc. Common Stock
352,IONS,Ionis Pharmaceuticals Inc. Common Stock
353,IOSP,Innospec Inc. Common Stock
354,IOVA,Iovance Biotherapeutics Inc. Common Stock
355,IPAR,Inter Parfums Inc. Common Stock
356,IPGP,IPG Photonics Corporation Common Stock
357,IQ,iQIYI Inc. American Depositary Shares
358,IRDM,Iridium Communications Inc Common Stock
359,IRTC,iRhythm Technologies Inc. Common Stock
360,ISBC,Investors Bancorp Inc. Common Stock
361,ISRG,Intuitive Surgical Inc. Common Stock
362,ITCI,Intra-Cellular Therapies Inc. Common Stock
363,ITRI,Itron Inc. Common Stock
364,JAMF,Jamf Holding Corp. Common Stock
365,JAZZ,Jazz Pharmaceuticals plc Common Stock (Ireland)
366,JBHT,J.B. Hunt Transport Services Inc. Common Stock
367,JBLU,JetBlue Airways Corporation Common Stock
368,JD,JD.com Inc. American Depositary Shares
369,JJSF,J & J Snack Foods Corp. Common Stock
370,JKHY,Jack Henry & Associates Inc. Common Stock
371,JOBS,51job Inc. American Depositary Shares
372,KDP,Keurig Dr Pepper Inc. Common Stock
373,KHC,The Kraft Heinz Company Common Stock
374,KLAC,KLA Corporation Common Stock
375,KLIC,Kulicke and Soffa Industries Inc. Common Stock
376,KNBE,KnowBe4 Inc. Class A Common Stock
377,KOD,Kodiak Sciences Inc Common Stock
378,KRNT,Kornit Digital Ltd. Ordinary Shares
379,KRTX,Karuna Therapeutics Inc. Common Stock
380,KTOS,Kratos Defense & Security Solutions Inc. Common Stock
381,LAMR,Lamar Advertising Company Class A Common Stock
382,LANC,Lancaster Colony Corporation Common Stock
383,LAUR,Laureate Education Inc. Common Stock
384,LAZR,Luminar Technologies Inc.  Class A Common Stock
385,LBRDA,Liberty Broadband Corporation Class A Common Stock
386,LBRDK,Liberty Broadband Corporation Class C Common Stock
387,LBTYA,Liberty Global plc Class A Ordinary Shares
388,LBTYB,Liberty Global plc Class B Ordinary Shares
389,LBTYK,Liberty Global plc Class C Ordinary Shares
390,LCID,Lucid Group Inc. Common Stock
391,LECO,Lincoln Electric Holdings Inc. Common Shares
392,LEGN,Legend Biotech Corporation American Depositary Shares
393,LESL,Leslie's Inc. Common Stock
394,LFST,LifeStance Health Group Inc. Common Stock
395,LFUS,Littelfuse Inc. Common Stock
396,LGIH,LGI Homes Inc. Common Stock
397,LHCG,LHC Group Common Stock
398,LI,Li Auto Inc. American Depositary Shares
399,LILA,Liberty Latin America Ltd. Class A Common Stock
400,LILAK,Liberty Latin America Ltd. Class C Common Stock
401,LITE,Lumentum Holdings Inc. Common Stock
402,LIVN,LivaNova PLC Ordinary Shares
403,LKFN,Lakeland Financial Corporation Common Stock
404,LKQ,LKQ Corporation Common Stock
405,LMDX,LumiraDx Limited Common Shares
406,LNT,Alliant Energy Corporation Common Stock
407,LOB,Live Oak Bancshares Inc. Common Stock
408,LOGI,Logitech International S.A. Ordinary Shares
409,LOPE,Grand Canyon Education Inc. Common Stock
410,LPLA,LPL Financial Holdings Inc. Common Stock
411,LPRO,Open Lending Corporation Class A Common Stock
412,LRCX,Lam Research Corporation Common Stock
413,LSCC,Lattice Semiconductor Corporation Common Stock
414,LSTR,Landstar System Inc. Common Stock
415,LSXMA,Liberty Media Corporation Series A Liberty SiriusXM Common Stock
416,LSXMB,Liberty Media Corporation Series B Liberty SiriusXM Common Stock
417,LSXMK,Liberty Media Corporation Series C Liberty SiriusXM Common Stock
418,LULU,lululemon athletica inc. Common Stock
419,LYFT,Lyft Inc. Class A Common Stock
420,LZ,LegalZoom.com Inc. Common Stock
421,MANH,Manhattan Associates Inc. Common Stock
422,MANT,ManTech International Corporation Common Stock $0.01 Par Value
423,MAR,Marriott International Class A Common Stock
424,MARA,Marathon Digital Holdings Inc. Common Stock
425,MASI,Masimo Corporation Common Stock
426,MAT,Mattel Inc. Common Stock
427,MCFE,McAfee Corp. Class A Common Stock
428,MCHP,Microchip Technology Incorporated Common Stock
429,MDB,MongoDB Inc. Class A Common Stock
430,MDLZ,Mondelez International Inc. Class A Common Stock
431,MDRX,Allscripts Healthcare Solutions Inc. Common Stock
432,MEDP,Medpace Holdings Inc. Common Stock
433,MELI,MercadoLibre Inc. Common Stock
434,MEOH,Methanex Corporation Common Stock
435,MGEE,MGE Energy Inc
436,MIDD,Middleby Corporation (The) Common Stock
437,MIME,Mimecast Limited Ordinary Shares
438,MKSI,MKS Instruments Inc. Common Stock
439,MKTX,MarketAxess Holdings Inc. Common Stock
440,MLCO,Melco Resorts & Entertainment Limited American Depositary Shares
441,MLKN,MillerKnoll Inc. Common Stock
442,MMSI,Merit Medical Systems Inc. Common Stock
443,MMYT,MakeMyTrip Limited Ordinary Shares
444,MNDT,Mandiant Inc. Common Stock
445,MNDY,monday.com Ltd. Ordinary Shares
446,MNST,Monster Beverage Corporation
447,MNTV,Momentive Global Inc. Common Stock
448,MORN,Morningstar Inc. Common Stock
449,MPWR,Monolithic Power Systems Inc. Common Stock
450,MQ,Marqeta Inc. Class A Common Stock
451,MRCY,Mercury Systems Inc Common Stock
452,MRNA,Moderna Inc. Common Stock
453,MRTX,Mirati Therapeutics Inc. Common Stock
454,MRVI,Maravai LifeSciences Holdings Inc. Class A Common Stock
455,MRVL,Marvell Technology Inc. Common Stock
456,MSFT,Microsoft Corporation Common Stock
457,MSTR,MicroStrategy Incorporated Common Stock Class A
458,MTCH,Match Group Inc. Common Stock
459,MTSI,MACOM Technology Solutions Holdings Inc. Common Stock
460,MTTR,Matterport Inc. Class A Common Stock
461,MU,Micron Technology Inc. Common Stock
462,MXL,MaxLinear Inc. Common Stock
463,MYGN,Myriad Genetics Inc. Common Stock
464,NARI,Inari Medical Inc. Common Stock
465,NATI,National Instruments Corporation Common Stock
466,NAVI,Navient Corporation Common Stock
467,NBIX,Neurocrine Biosciences Inc. Common Stock
468,NCNO,nCino Inc. Common Stock
469,NDAQ,Nasdaq Inc. Common Stock
470,NDSN,Nordson Corporation Common Stock
471,NEO,NeoGenomics Inc. Common Stock
472,NEOG,Neogen Corporation Common Stock
473,NFE,New Fortress Energy Inc. Class A Common Stock
474,NFLX,Netflix Inc. Common Stock
475,NICE,NICE Ltd American Depositary Shares
476,NKLA,Nikola Corporation Common Stock
477,NLOK,NortonLifeLock Inc. Common Stock
478,NMIH,NMI Holdings Inc. Class A Common Stock
479,NMRK,Newmark Group Inc. Class A Common Stock
480,NOVT,Novanta Inc. Common Stock
481,NSIT,Insight Enterprises Inc. Common Stock
482,NTAP,NetApp Inc. Common Stock
483,NTCT,NetScout Systems Inc. Common Stock
484,NTES,NetEase Inc. American Depositary Shares
485,NTLA,Intellia Therapeutics Inc. Common Stock
486,NTNX,Nutanix Inc. Class A Common Stock
487,NTRA,Natera Inc. Common Stock
488,NTRS,Northern Trust Corporation Common Stock
489,NUAN,Nuance Communications Inc. Common Stock
490,NUVA,NuVasive Inc. Common Stock
491,NVAX,Novavax Inc. Common Stock
492,NVCR,NovoCure Limited Ordinary Shares
493,NVDA,NVIDIA Corporation Common Stock
494,NVEI,Nuvei Corporation Subordinate Voting Shares
495,NVMI,Nova Ltd. Ordinary Shares
496,NWE,NorthWestern Corporation Common Stock
497,NWL,Newell Brands Inc. Common Stock
498,NWS,News Corporation Class B Common Stock
499,NWSA,News Corporation Class A Common Stock
500,NXPI,NXP Semiconductors N.V. Common Stock
501,NXST,Nexstar Media Group Inc. Class A Common Stock
502,OAS,Oasis Petroleum Inc. Common Stock
503,OCDX,Ortho Clinical Diagnostics Holdings plc Ordinary Shares
504,ODFL,Old Dominion Freight Line Inc. Common Stock
505,ODP,The ODP Corporation Common Stock
506,OKTA,Okta Inc. Class A Common Stock
507,OLED,Universal Display Corporation Common Stock
508,OLLI,Ollie's Bargain Outlet Holdings Inc. Common Stock
509,OLPX,Olaplex Holdings Inc. Common Stock
510,OMAB,Grupo Aeroportuario del Centro Norte S.A.B. de C.V. ADS
511,OMCL,Omnicell Inc. Common Stock ($0.001 par value)
512,ON,ON Semiconductor Corporation Common Stock
513,ONB,Old National Bancorp Common Stock
514,OPCH,Option Care Health Inc. Common Stock
515,OPEN,Opendoor Technologies Inc Common Stock
516,OPK,OPKO Health Inc. Common Stock
517,ORLY,O'Reilly Automotive Inc. Common Stock
518,OTEX,Open Text Corporation Common Shares
519,OTLY,Oatly Group AB American Depositary Shares
520,OTTR,Otter Tail Corporation Common Stock
521,OZK,Bank OZK Common Stock
522,OZON,Ozon Holdings PLC American Depositary Shares each ADS representing one ordinary share
523,PAA,Plains All American Pipeline L.P. Common Units representing Limited Partner Interests
524,PAAS,Pan American Silver Corp. Common Stock
525,PACB,Pacific Biosciences of California Inc. Common Stock
526,PACW,PacWest Bancorp Common Stock
527,PAGP,Plains GP Holdings L.P. Class A Units representing Limited Partner Interests
528,PANW,Palo Alto Networks Inc. Common Stock
529,PAX,Patria Investments Limited Class A Common Shares
530,PAYX,Paychex Inc. Common Stock
531,PBCT,People's United Financial Inc. Common Stock
532,PCAR,PACCAR Inc. Common Stock
533,PCH,PotlatchDeltic Corporation Common Stock
534,PCRX,Pacira BioSciences Inc. Common Stock
535,PCTY,Paylocity Holding Corporation Common Stock
536,PDCE,PDC Energy Inc. Common Stock (Delaware)
537,PDCO,Patterson Companies Inc. Common Stock
538,PDD,Pinduoduo Inc. American Depositary Shares
539,PECO,Phillips Edison & Company Inc. Common Stock
540,PEGA,Pegasystems Inc. Common Stock
541,PENN,Penn National Gaming Inc. Common Stock
542,PEP,PepsiCo Inc. Common Stock
543,PFG,Principal Financial Group Inc Common Stock
544,PGNY,Progyny Inc. Common Stock
545,PINC,Premier Inc. Class A Common Stock
546,PLTK,Playtika Holding Corp. Common Stock
547,PLUG,Plug Power Inc. Common Stock
548,PLXS,Plexus Corp. Common Stock
549,PNFP,Pinnacle Financial Partners Inc. Common Stock
550,PODD,Insulet Corporation Common Stock
551,POOL,Pool Corporation Common Stock
552,POWI,Power Integrations Inc. Common Stock
553,PPBI,Pacific Premier Bancorp Inc
554,PPC,Pilgrim's Pride Corporation Common Stock
555,PRFT,Perficient Inc. Common Stock
556,PRGS,Progress Software Corporation Common Stock (DE)
557,PRVA,Privia Health Group Inc. Common Stock
558,PSEC,Prospect Capital Corporation Common Stock
559,PSMT,PriceSmart Inc. Common Stock
560,PTC,PTC Inc. Common Stock
561,PTCT,PTC Therapeutics Inc. Common Stock
562,PTEN,Patterson-UTI Energy Inc. Common Stock
563,PTON,Peloton Interactive Inc. Class A Common Stock
564,PYCR,Paycor HCM Inc. Common Stock
565,PYPL,PayPal Holdings Inc. Common Stock
